{
  "$schema": "https://json-schema.org/draft/2020-12/schema",
  "$id": "https://mineops.io/schemas/localization.schema.json",
  "title": "MineOps Catalog Localization",
  "description": "Key-value localization lookup table. One artifact in the versioned JSON package.",
  "type": "object",
  "additionalProperties": false,
  "required": [
    "schemaVersion",
    "catalogVersion",
    "releaseId",
    "generatedAt",
    "locale",
    "entries"
  ],
  "properties": {
    "schemaVersion": {
      "type": "string",
      "const": "1.0.0",
      "description": "Version of this localization schema."
    },
    "catalogVersion": {
      "type": "string",
      "minLength": 1,
      "description": "Deterministic bundle version string matching the manifest."
    },
    "releaseId": {
      "type": "string",
      "minLength": 1,
      "description": "Source release identity from the capture envelope."
    },
    "generatedAt": {
      "type": "string",
      "format": "date-time",
      "description": "ISO-8601 timestamp when this artifact was generated."
    },
    "locale": {
      "type": "string",
      "minLength": 1,
      "description": "BCP 47 locale tag (e.g. 'en', 'en-US')."
    },
    "entries": {
      "type": "object",
      "additionalProperties": { "type": "string" },
      "description": "Key-value localization entries. Keys are localization keys; values are localized strings."
    }
  }
}
