{
  "catalogVersion": "4.42.1-test-fixture",
  "entries": {
    "al_titude": "Al Titude",
    "blingsley": "Blingsley",
    "chester": "Chester",
    "chris_cappella": "Chris Cappella",
    "damian_jones": "Damian Jones",
    "dr_lilly": "Dr. Lilly",
    "dr_steiner": "Dr. Steiner",
    "ezio_auditore": "Ezio Auditore",
    "goodman_jr": "Goodman Jr.",
    "gordon": "Gordon",
    "jade_kim": "Jade Kim",
    "lee_vatori": "Lee Vatori",
    "luna_stella": "Luna & Stella",
    "mark": "Mark",
    "mr_goodman": "Mr. Goodman",
    "mr_turner": "Mr. Turner",
    "mrs_goodman": "Mrs. Goodman",
    "professor_impossible": "Professor Impossible",
    "queen_aurora": "Queen Aurora",
    "rabbid_blingsley": "Rabbid Blingsley",
    "ranger_sue": "Ranger Sue",
    "samantha_reiss": "Samantha Reiss",
    "santa_2020": "Santa 2020",
    "santa_claus": "Santa Claus",
    "sir_henry": "Sir Henry",
    "sir_lorenzo": "Sir Lorenzo",
    "sojo": "Sojo",
    "utux": "Ut'ux",
    "violet_evergreen": "Violet Evergreen",
    "wolfgang_clawson": "Wolfgang Clawson",
    "zi_glavani": "Zi Glavani"
  },
  "generatedAt": "2026-07-17T22:23:51.755Z",
  "locale": "en",
  "releaseId": "test-fixture-20260717",
  "schemaVersion": "1.0.0"
}
